Job Title,Job Description
Flutter Developer,"We are looking for an Android developer who ideally have experience in Flutter also One who wants grow with the organization and wants to work on multiple platforms
Required Skills
Should have worked and successfully deployed apps using Flutter framework
Experience with thirdparty libraries and Social SDKs integration
Experience in API integration
Strong knowledge of Oops concepts and dart language
Should familiar with project structures like BLOC Pattern
Strong knowledge of Flutter and how to deal with different screen sizes
Addon knowledge of Android SDK different versions of Android
Strong knowledge of UI design principles patterns and best practices
Understanding of Googles Android design principles and interface guidelines
Should have basic knowledge of generating iOS Builds and Uploading to App store
Proficient understanding of code versioning tools such as Git
Experience 15 Years 4 Years
Qualification Any Graduate BTech BSc MSc BCA MCA etc are eligible for this position
Location Mohali
Job Type Fulltime
Salary 2500000 5000000 per month
Schedule
Day shift
Morning shift
Experience
Flutter 1 year Required
Total Work 1 year Required"
Backend Developer,"NOTE Joining Immediately
Experience 45 Years
Location DELHI
Requirements Responsibilities
3 years of experience developing web applications using J2EE
 23 year of experience in Spring Boot
 knowledge of MicroServices will be given advantages
 Experience working with SOAP Rest Oauth2 MySQL Tomcat Springboot Microservices
 Expertise developing enterpriselevel web applications and RESTful APIs using MicroServices with demonstrable productionscale experience
 Working experience in Industry Standard protocols related API Security is a must
 Demonstrate strong design and programming skills using JSON Web Services XML XSLT PLSQL in Unix Linux and Windows environments
 Strong background working with LinuxUNIX environments
 Strong Shell scripting experience
 Working knowledge with MySQL DB2 or Mongo DB databases
 Passion to stay on top of the latest happenings in the tech world and an attitude to discuss and bring those into play
 Strong agilescrum development experience
 Strong collaboration and communication skills within distributed project teams
Job Type Fulltime
Schedule
Day shift
Experience
JSP 1 year Preferred
j2ee 4 years Preferred
springboot 3 years Preferred
Education
Bachelors Preferred
Licence
Java SE 7 Programmer Preferred
Industry
Software Development
Work Remotely
No"
Flutter Developer,"We are looking for an Android developer responsible for the development and maintenance of applications aimed at a vast number of diverse Android devices Your primary focus will be the development of Android applications and their integration with backend services You will be working alongside other engineers and developers working on different layers of the infrastructure Therefore commitment to collaborative problem solving sophisticated design and creating quality products is essential
Responsibilities
Translate designs and wireframes into high quality code
Design build and maintain high performance reusable and reliable Java code
Ensure the best possible performance quality and responsiveness of the application
Identify and correct bottlenecks and fix bugs
Help maintain code quality
Job Type Fulltime
Salary 2500000 per month
Schedule
Day shift
Experience
Android development 2 years Required
work 2 years Preferred
FlutterDevelopment 2 years Required
Education
Diploma Preferred
Work Remotely
No"
Machine Learning,"Job Description
We are looking for an experienced Data Scientist having excellent working knowledge of NLP deep learning frameworks HeShe should be keen to collaborate with product and engineering heads using notebooks and visualizations Heshe should ask right questions connect the dots and uncover hidden potential of data
Responsibilities
 Work as the lead data strategist identifying and integrating new datasets that can be leveraged through the product capabilities and work closely with the engineering team to strategize and execute the development of data products
 Develop advanced algorithms that solve problems of large dimensionality in a computationally efficient and statistically effective manner
 Execute application of statistical and data mining techniques eg hypothesis testing machine learning and retrieval processes on large unstructured data sets to identify trends figures and other relevant information
 Evaluate emerging datasets and technologies
 Own development of select assetsaccelerators that create scale
Mandatory skillset
 Deep understanding and experience with Python libraries Pandas and Numpy in regards to Large dataset processing and Linear Algebra respectively
 Excellent understanding of Statistics Probability using Python
 Ability to write debug and resolve issues in complex SQL scripts
 Good experience with at least one NLP library Spacy Gensim NLTK
 Good understanding of NLP concepts Stemming Lemmatization NER TFIDF WordNet Bag of words Rule based NLP vs Statistical NLP current challenges in NLP
 Good experience with at least one Notebook Jupyter Google Collab AWS sagemaker and comfortable with visualization using matplotlib seaborn
 Exposure to Scikit based machine learning models
 Experience with Feature Engineering concepts Feature Selection Feature transformation Feature extraction
 Experience with AWS services Conceptual understanding of AWS Lambda
 Experience with distributed training MLOps modeljoblib pkl model deployment awareness of approach towards shipping trained model to production
 Conceptual understandingPOC of Deep learning basics Neural networks TensorflowKeras Classification Regression
Optional Skillset
 Transfer Learning using BERT
 Experience with Data warehouse like AWS Redshift Snowflake Google Bigquery
Skills 
deep learning frameworks Scripting NLP libraries Testing Python Algorithms aws SQL
Job Type Fulltime
Salary 36012100 170641000 per year
Schedule
Day shift
Experience
total worNLP library Spacy Gensim NLTKk 5 years Preferred
Python libraries Pandas and Numpy i 5 years Preferred
wAWS services Conceptual understanding of AWS Lambdaork 5 years Preferred
Education
Secondary10th Pass Preferred"
Backend Developer,"The Offer
Hone skills within a leading design and development firm
Opportunity to work on exciting projects
A closeknit and highly collaborative team
The Employer
Our client is a design and development firm that that has won multiple awards for their work for both big brands and startups They have the skills aesthetics and a team that is passionate about product experiences that is able to make any brand shine
The Job
You will be responsible for 
Writing welldesigned testable and efficient code
Gathering and evaluating user feedback
Working as a part of a dynamic team to deliver winning products
Providing code documentation and other inputs to technical documents
Supporting continuous improvement by investigating alternatives and new technologies and presenting these for architectural review
Troubleshooting and debugging to optimise performance
Architecting designing developing and deploying new features for web sites and frontend web applications
Participating in release and sprint planning sessions
The Profile
You possess a DegreeDiploma in Computer Science Engineering or related field with at least 1 year experience within a Software Engineer role
You possess strong knowledge of Django Java Nodejs Python Javascript JSON and Go
Expertise in Agile Object Oriented Programming Design Software Development and Web Development would be highly valuable
You are familiar with MacOS LINUX Redhat UBUNTU etc and UNIX operating systems
You have good knowledge of MySQL NOSQL Databases eg MongoDB Cassandra Elasticsearch PostgreSQL Redis and GraphQL databases
You are highly goal driven and work well in fast paced environments
You are adaptable and thrive in changing environments
You are a strong team player who can manage multiple stakeholders
Ref 91031198
00600 Years"
Network Administrator,"Circle Security Officer Operations
Job Description 
Job Responsibilities 
Security of FTTX Network Patrolling Theft Investigations Audits of
FTTX nodes Implementation of all SLP policies coordination with
NWFTTX teams
Compliance of id cards Jio Mitra engagement SAS project
implementation and uptime of SAS equipment
Manage budget of NW SLP for the circle
Security of 4G Network Patrolling of 4G Network Theft
Investigations Site Audits of small medium and LFL
Access control of all network sites Implementation of all SLP
policies coordination with NW teams Compliance of id cards with NW
teamssolparsSP team etc Jio Mitra engagement SAS project
Implementation and uptime of SAS equipment Manage budget of NW SLP
for the circle
Skills Competencies 
Experience in Fibre operation maintenance OSP Infra maintenance
Experience in telecom security operations ISPOSP project
deployment network rollout network operations
Team Management
Decision Making
Analytical Thinking
Interpersonal Skills
Communication Skills"
Wordpress Developer,"Job Description
2 years of professional wordpress website development experience
Proficiency in HTML CSS Bootstrap jQuery and JavaScript for best designs
Hands on experience in WordPress CMS and any WooCommerce framework
Experienced developing Mobile responsive websites
Proficiency in Photoshop Illustrator or other visual tools
implement and maintain highquality SEO policies and having real time experience in optimizing the website on page loading speed
Uptodate with the latest Web trends techniques and technologies
Professional portfolio with at least 10 Wordpress Website and 5 Woocommerce websites for internal review
Job Type Fulltime
Salary Up to 30000000 per year
Experience
Wordpress 2 years Preferred
Woocommerce 1 year Preferred
Education
Bachelors Preferred
Location
Bengaluru Karnataka Preferred
Work Remotely
Temporarily due to COVID19"
Full Stack Developer,360insights culture driven simple concept happiness believe happiness make better business better world know make difference team serf client awarded best workplace canada great place work institute rocking net promoter score 88 360insights redefining client experience ton fun process seeking full stack developer join farmington hill michigan based development team candidate part team responsible delivering roadmap channel success platform position top brand world pushing mission critical data system confronted amazing challenge building platform scale impressive growth constant need innovation help u design implement api platform push 360insights next level responsibility build reststyle apis angular web api continuously improve quality code help peer peer review refactoring automated testing etc constantly learn identify integrate high quality library solve problem reinvent wheel automate deployment microsoft application system configuration security setting qualification degree computer science software engineering related discipline minimum 5 year fulltime serverside experience writing productionquality code solid foundation javascript experience writing sql query windowslinux server experience experience test driven development domain driven design distributed system preferred experience c net angular microservices asset company overview 360insights focused constant innovation delivering informed approach world consumer sale channel incentive management offering industryleading technology combined uncompromising personalized customer service customer among world leading brand actively seek partner company want show leadership offering incentive rebate program engage motivate channel building customer loyalty offering easy efficient way redeem claim company partner community member focused making difference business done world large information visit www360insightscom
Backend Developer,"Responsibilities and Duties 
Developing deploying and maintaining PHP based web applications
Create solutions for the backend systems to support of users
Deploy the web applications on various types of production environment Linux Windows servers etc
Work in coordination with frontend developers in designing architecture and implement designing strategy
Understand the database architecture and provide necessary optimization of the same
ReviewImprove upon current processesmethodologies
Monitoring development activities and reporting project progress
Required Experience Skills and Qualifications 
Must have 45 years of experience in developing web applications using core PHP and Wordpress
Must be knowledgeablehave experience working on AWS Server Certification preferred
Solid knowledge of AJAX JavaScript HTML CSS3 Boostrap
Sound Knowledge of web deployment concepts web services such as REST and SOAP APIs
Expert knowledge of MySQL and database technologies
Experience with MVC and OOP design patterns
Job Type Fulltime
Salary 30000000 65000000 per year
Schedule
Day shift
Experience
PHP 4 years Required
Application Question
Do you have experience of working on AWS
Work Remotely
Temporarily due to COVID19"
iOS Developer,"Skill Sets
 Proven working experience in software development
 Working experience in iOS development
 Have published one or more iOS apps in the app store
 A deep familiarity with ObjectiveC and Cocoa Touch
 Experience working with iOS frameworks such as Core Data Core Animation Core Graphics and Core Text
 Experience with thirdparty libraries and APIs
 Working knowledge of the general mobile landscape architectures trends and emerging technologies
 Solid understanding of the full mobile development life cycle
Responsibilities
 Design and build advanced applications for the iOS platform
 Collaborate with crossfunctional teams to define design and ship new features
 Unittest code for robustness including edge cases usability and general reliability
 Work on bug fixing and improving application performance
 discover evaluate and implement new technologies to maximize development efficiency
Job Type Fulltime
Pay 10000000 40000000 per year
Schedule
Day shift
Supplemental Pay
Quarterly bonus
Experience
work 1 year Preferred
total work 1 year Preferred
iOS 1 year Preferred
Education
Bachelors Preferred
Programming Languages needed
ObjectiveC Preferred"
Software Engineer,"The ideal candidate for this position would be a passionate Web Development technical lead proficient in building and running modern scalable rich web applications at scale At BlueJeans we are changing the way the world collaborates on video and the candidate will be an integral part of the team that helps scale our service to meet the spiralling demand induced by workfromhome necessity
The ideal candidate will
Have a passion for technology with strong design and problem solving skills
Have excellent oral and written communication skills
Have experience designing implementing and deploying large scalable web services
Be proficient in ES6HTML5css3 and Javascript based FrontEnds such as React or BackboneAngularEmber
Be proficient in atleast one server side language such as Nodejs
Have a good understanding of eventdriven architectures
Have experience working with RESTful APIs and common RESTful design patterns
Be able to communicate and work well within a geographically distributed team
Requirements
8 years of product development experience
2 years of experience technically leading a high performing product development team
Experience of working with RESTful APIs
Excellent knowledge of OOPS Design patterns
BEBTech in Computer Science or related field
Familiarity with deployments on Amazon or Azure
Familiarity with setup of MonitoringAlertAnalytics systems to track health of services in real time
Interest in mentoring junior developers on the team in their technical growth
Habit of maintaining a tight feedback loop for developers and internal users by doing testdriven development at the unit and acceptancetest level for fast feedback
You get bonus points for
Real time communication via webrtc
Browser extensions for chrome or firefox
Understanding latest developments in key technologies and how this impacts your work
Understanding of database technologies SQL and NoSQL such as couchbase and mongodb as well as API cache design and caching technologies
Experience in scaling large high transaction volume web services
Experience in mobile development
Contributions to open source projects
Experience in influencing partners like Microsoft Google and others in the areas of WebRTC and web standards managed runtime JavaScript Typescript etc React and open source efforts
Verizon recently acquired BlueJeans and plans to integrate BlueJeans employees into Verizon including its compensation and benefits programs in due course This position will be part of that planned integration"
Network Administrator,"NVIDIA Network Engineering is looking for a Network Engineer to join its fast paced and results oriented team Challenges include balancing project responsibilities with escalated operational issues If you have a primary skillset in the routing and switching foundation with the ability to define and lead primarily Engineering LAB Network refresh upgrades globally this job might be for you
What youll be doing
Designs plans and coordinates the implementation of network technologies in support of defined requirements generated by business and growth demands for Labs
Validate project requirements define project scope develop project schedules and produce detailed designs for assigned projects
Produce work breakdown structures that demonstrate understanding of proposed changes and how the change will be executed with minimal service impact
Performs analysis and diagnosis of highly complex networking problems
Builds simulated networks in test labs to resolve highly challenging problems and compatibility issues
Prepare and maintain up to date documentation detailing configuration of deployed solutions Generates network configurations
Plans and executes highly complex network upgrade and migration activity
Assists with deployment and strategy of tools and related Network Management Systems
Provides mentorship for existing network team members as appropriate
What we need to see
BS or equivalent plus 10 years progressive experience in Network engineering support environment
Experience and expertise in network operations and service optimization in highly available network infrastructure solutions in a largescale multisite international environment with design experience
Expert knowledge of Mellanox Cumulus Arista Cisco Datacenter Switching technologies used in large scale Engineering Labs Data Center Deployments
Strong and Indepth knowledge of Engineering LAB Network Technologies
Expertise in IP inter networking LAN Switching Wireless Technologies
WAN circuits and protocols VPLS MPLS DWDM DMVPN Optimization
Dynamic IP Routing protocols OSPF ISIS EIGRP BGP PIM Multicast
Experience on latest hardware and operating systems Cumulus Arista EOS CRS Nexus IOSXR NXOS Junos
Experience in interAS connectivity eBGP MPLS
High Availability protocols and Global Server Load Balancing technologies
New Generation Firewalls Stateful firewalls SSL VPN
Virtualization technologies both networking VRF VDC Nexus1kv and compute VMware Openstack
High level inter networking troubleshooting in a largescale network environment
Knowledge of network management network availability and capacity planning
Expertise in interfacing with carriers to manage circuit delivery troubleshooting and migration
Must have exceptional verbal written interpersonal and presentation skills
Must be creative and have initiative
CCIE or equivalent is a plus
Ways to stand out from the crowd
Selfdriven and resourceful to achieve goals independently as well as work well in groups
Flexibility to adjust to changing requirements schedules and priorities The ability to socialize ideas make recommendations and gather team consensus to move forward
Must be able to effectively communicate both orally and in writing to technical and nontechnical audiences at all levels in the organization develop procedural documentation develop and conduct effective presentations and effectively demonstrate products and solutions
Ability to connect new technology initiatives to cost savings and ROI calculations
NVIDIA is leading the way in groundbreaking developments in Artificial Intelligence HighPerformance Computing and Visualization The GPU our invention serves as the visual cortex of modern computers and is at the heart of our products and services Our work opens up new universes to explore enables amazing creativity and discovery and powers what were once science fiction inventions from artificial intelligence to autonomous cars NVIDIA is looking for exceptional people like you to help us accelerate the next wave of artificial intelligence"
Network Administrator,"An IT executive is often responsible for Overseeing company IT functions or specific technology functions within a department Determining IT budget and equipment needs No matter the job title IT executives are responsible for the direction team
consist of seniorlevel managers and other staff The job of an IT executive is to oversee the information technology needs of an organization including supervising subordinates coordinating software implementation and upgrades determining IT budget and equipment needs and ensuring systems security"
Wordpress Developer,"Desired Candidate Profile Should have done wordpress projects on their own
 Catalogue building as per the requirements including configurable products complex product types with multi level options Integration of Payment Gateways Shipping Rates based on several attributes Promotions Newsletters Microdata Custom module extension app development
 Act as wordpress expert specializing in all facets of the ecommerce platform Produce sea
1Exp in building web applications using PHP WordPress
2Extensive knowledge of Object Oriented JavaScript HTML5 CSS3 SASSLESS Bootstrap
3Proficiency in other JavaScript frameworks AngularJS ExtJS ReactJS jQuery
Job Location Noida
Experience Years 12 Years"
Full Stack Developer,looking exciting career opportunity digital advertising marketing working fastgrowing company run ongoing digital social campaign today top brand clientele ranging espn disney simplehuman celebrity charity campaign monkedia place looking someone passion building advanced web application software full stack php developer responsible developing advanced inhouse software leverage take stance one industry forwardthinking company talented developer currently work lot html cs apis database jquery j serverside language like php ruby loving bit much great thing monkedia like people well rounded whether back end front end s always good rounded set skill chip help others needed individual best suited position one high attention detail mind algorithm creative software application great amount personal drive want part accomplishing thing never accomplished internet place role particular key effort developed internal software better serve client skill requirement software development experience php knowledge mvc structure 3 year experience linux apache mysql php lamp architecture good knowledge relational database ability design write raw mysql query 3 year demonstrable knowledge web technology output language html5 css3 javascript jquery experience frontend javascript framework bootstrapangularreactetc experience thirdparty apis facebook google twitter amazon aws etc ability work individually manager creative team involved system development life cycle experience crossbrowser compatibility crossplatform testing competent image manipulation skill adobe photoshop deep understanding web standard best practice preference experience redshiftbigdata cli command line interface experience comfortable using basic command linux environment accessing using mysql cli monkedia monkedia believe people greatest part business invested finding driven passionate charismatic individual become part team perk la colinas office easily accessible several major highway many restaurant retail within 5 min office stay home need unlimited sick day voted 2018 best brightest work friday happy hour fullystocked vending machine price low vendor cost monthly company team eventsoutings like onsite laser tag tournament christmas light show company casino night free parking 1 hour lunch break smart casual dress code jean flannel welcome benefit competitive salary medical dental vision life disability insurance plan paid vacation day 9 paid holiday position based la colinas office chance build career collaborative engaging team part fast growing creative company leading initiative social medium advertising need brain ambition passion continue helping connect kind product service customer globe monkedia care le badge honor accomplished positive opportunity employer give opportunity le school graduated done wellrounded humanbeing applying sure send u accolade paying attention sure include favorite company celebrity follow social medium cover letter
