Job Title,Job Description
Software Engineer,Role ProficiencyLevel of ProficiencyAct creatively to develop applications by selecting appropriate technical options optimizing application development maintenance and performance by employing design patterns and reusing proven solutions Account for others developmental activities assisting Project Manager in day to day project executionOutcomes1 Interpret the application feature and component designs to develop the same in accordance with specifications 2 Code debug test document and communicate product component and feature development stages 3 Validate results with user representatives integrating and commissions the overall solution 4 Select and create appropriate technical options for development such as reusing improving or reconfiguration of existing components while creating own solutions for new contexts 5 Optimises efficiency cost and quality 6 Influence and improve customer satisfaction 7 Influence and improve employee engagement within the project teams 8 Set FAST goals for selfteam provide feedback to FAST goals of team membersMeasures of OutcomesMeasures1 Adherence to engineering process and standards coding standards 2 Adherence to project schedule timelines 3 Number of technical issues uncovered during the execution of the project 4 Number of defects in the code 5 Number of defects post delivery 6 Number of non compliance issues 7 Percent of voluntary attrition 8 On time completion of mandatory compliance trainingsOutputs ExpectedCodeCode as per the design Define coding standards templates and checklists Review code for team and peersDocumentationCreatereview templates checklists guidelines standards for designprocessdevelopment Createreview deliverable documents Design documentation requirements test cases and resultsConfigureDefine and govern configuration management plan Ensure compliance from the teamTestReviewCreate unit test cases scenarios and execution Review test plan created by testing team Provide clarifications to the testing teamDomain relevanceAdvise software developers on design and development of features and components with deeper understanding of the business problem being addressed for the client Learn more about the customer domain and identify opportunities to provide value addition to customers Complete relevant domain certificationsManage ProjectSupport Project Manager with inputs for the projects Manage delivery of modules Manage complex user storiesManage DefectsPerform defect RCA and mitigation Identify defect trends and take proactive measures to improve qualityEstimateCreate and provide input for effort and size estimation and plan resources for projectsManage knowledgeConsume and contribute to project related documents share point libraries and client universities Review the reusable documents created by the teamReleaseExecute and monitor release processDesignContribute to creation of design HLD LLD SADarchitecture for applications features business components and data modelsInterface with CustomerClarify requirements and provide guidance to Development Team Present design options to customers Conduct product demos Work closely with customer architects for finalizing designManage TeamSet FAST goals and provide feedback Understand aspirations of the team members and provide guidance opportunities etc Ensure team members are upskilled Ensure team is engaged in project Proactively identify attrition risks and work with BSE on retention measuresCertificationsObtain relevant domain and technology certificationsSkill Examples1 Explain and communicate the design development to the customer 2 Perform and evaluate test results against product specifications 3 Break down complex problems into logical components 4 Develop user interfaces business software components 5 Use data models 6 Estimate time and effort resources required for developing debugging features components 7 Perform and evaluate test in the customer or target environments 8 Make quick decisions on technicalproject related challenges 9 Manage a team mentor and handle people related issues in team 10 Have the ability to maintain high motivation levels and positive dynamics within the team 11 Interface with other teams designers and other parallel practices 12 Set goals for self and team Provide feedback for team members 13 Create and articulate impactful technical presentations 14 Follow high level of business etiquette in emails and other business communication 15 Drive conference calls with customers and answer customer questions 16 Proactively ask for and offer help 17 Ability to work under pressure determine dependencies risks facilitate planning handling multiple tasks 18 Build confidence with customers by meeting the deliverables timely with a quality product 19 Estimate time and effort of resources required for developing debugging features componentsKnowledge Examples 1 Appropriate software programs modules 2 Functional technical designing 3 Programming languages proficient in multiple skill clusters 4 DBMS 5 Operating Systems and software platforms 6 Software Development Life Cycle 7 Agile Scrum or Kanban Methods 8 Integrated development environment IDE 9 Rapid application development RAD 10 Modelling technology and languages 11 Interface definition languages IDL 12 Broad knowledge of customer domain and deep knowledge of sub domain where problem is solved
PHP Developer,"Job Description
14 years of experience as a PHP Developer with proven track
Requirements
Integration of userfacing elements developed by frontend developers
Build efficient testable and reusable PHP modules
Understanding the fully synchronous behavior of PHP
Basic understanding of frontend technologies such as JavaScript HTML5 and CSS3
Familiarity with limitations of PHP as a platform and its workarounds
Software Skills
frontend technologies such as JavaScript HTML5 and CSS3"
Full Stack Developer,position remote havas looking hire entry level developer creative technologist freelancer work contract 2530 hour per week 12 week tool ha built using following frameworksprogramming language backend linux command line php mysql frontend htmlcss javascriptjquery find fullstack developer know would ideal priority backend experience scope work would include designing planning technical spec creation new product feature rapid prototyping new functionality spanning data acquisition data analysis data visualization engineering refinement existing functionality improve speed stability specific project include connecting via api social publisher like facebook twitter snapchat designing data architecture storing social publisher data unified format despite broad range data structure across channel content format objective placement create automated script run api query store data dailyweeklympnthly cadence develop custom algorithm ranking content performance across quality scale efficiency metric generate simple accessible data visualization display organize social data help uncover insight generate script turn visualization web print asset presentation develop permission user management system
Backend Developer,"We are looking for a backend developer for Auriss Technologies Due to the pandemic you can work from home now But later when the situation gets back to normal you will have to work in Coimbatore
 Should have a minimum working experience of 3 years in NodeJS
 Preferable joining date by mid or end of November 2020
Expected Start Date 16112020
Job Type Fulltime
Experience
total work 3 years Preferred
Education
Bachelors Preferred
Work Remotely
Temporarily due to COVID19"
Java Developer,"Staff Engineer Java Full Stack
6 to 9 years of experience
ABOUT NAGARRO
Nagarro helps clients transform adapt and build new ways into the future through an entrepreneurial agile and caring mindset We excel at digital product engineering and deliver on our promise of thinking breakthroughs Today we are 8400 experts across 25 countries forming a Nation of Nagarrians ready to help our customers succeed
At Nagarro you can look forward to a work culture that is dynamic and nonhierarchical You will be given opportunities to add value to challenging and complex assignments while collaborating with world class technologists The versatile environment here helps foster fresh perspectives and enables you to deliver high quality code There will be ample opportunities provided for skill upgradation to accelerate your professional and personal development
WHAT MAKES YOU A GOOD FIT FOR THIS ROLE
Relevant experience in Java 8 or higher Spring FrameworkCoreBootMVC HibernateJPA HTML CSS Angular4 React JSEmberjsVuejs JavaScript and Microservices Architecture
Experience in SOA based architecture Web Services ApacheCXFJAXWSJAXRSSOAPREST
Experience in CICD DevOps JenkinsDockerAnsible Cloud AWS Unit Testing Performance Tuning
Hands on experience of RDBMS like SQL Server Oracle MySQL PostgreSQL
A good understanding of UML and design patterns
Knowledge of highquality professional software engineering practices for agile software development cycle including coding standards code reviews source control management build processes testing and deployment
Fundamental knowledge of design patterns
Experience in communicating effectively with users other technical teams and management to collect requirements describe software product features and technical designs
Passionate about building great solutions
Mentoring the team members to meet the clients needs and holding them accountable for high standards of delivery
Being able to understand and relate technology integration scenarios and be able to apply these learnings in complex troubleshooting scenarios
WHAT ARE YOUR RESPONSIBILITIES
Writing and reviewing great quality code
Understanding functional requirements thoroughly and analyzing the clients needs in the context of the project
Envisioning the overall solution for defined functional and nonfunctional requirements and being able to define technologies patterns and frameworks to realize it
Determining and implementing design methodologies and tool sets
Enabling application development by coordinating requirements schedules and activities
Being able to leadsupport UAT and production roll outs
Creating understanding and validating WBS and estimated effort for given moduletask and being able to justify it
Addressing issues promptly responding positively to setbacks and challenges with a mindset of continuous improvement
Giving constructive feedback to the team members and setting clear expectations
Helping the team in troubleshooting and resolving of complex bugs
Coming up with solutions to any issue that is raised during codedesign review and being able to justify the decision taken
Carrying out POCs to make sure that suggested designtechnologies meet the requirements"
DevOps Engineer,"About Us
SailPoint is the Worldwide Leader for EnterpriseClass IAM
We minimize risk and maximize business growth by managing access to data and resources across your enterprise We do it effectively and securely for every person who interacts with your organizationany user on any device anywhere in the world
We were first to recognize that companies could benefit from an approach to identity that addresses both IT and business priorities We developed a unique riskbased model and leveraged that approach for everything from compliance to user provisioning Then we followed that with the industrys first solution for truly extending enterprise identity management to applications in the cloud
Today we offer comprehensive products that can handle enterprise IAM onpremises or as a cloudbased service This gives you the freedom to choose the best solution for your current needs while at the same time establishing a clear path for future growth
The ideal candidate on the DevOps team will be a selfstarter who enjoys a fastpaced job thrives on problem solving and is committed to delivering seamless product availability to large enterprises around the world
Responsibilities
Build and maintain a resilient secure and efficient SaaS application platform to meet established SLAs
Automate build test and deployment for distributed faulttolerant infrastructure
Monitoring and incident response for distributed applications
Collaborate with developers to bring new features and services into production
Utilize a combination of opensource and custom software to solve product challenges
Design and implement IP Networking in VPC environment
Drive improvement to operational practices and procedures
Proactively meet standards for information security and compliance such as ISO SOX SSAE 16 etc
Background Experience
Experience in 24x7 production operations for a SaaS or cloud service provider
Experience with Amazon Web Services EC2 RDS IAM DynamoDB
Container orchestration and management platforms Kubernetes ECS Docker
Server and application monitoring Prometheus Grafana Elasticsearch Kibana
Deploying and managing Infrastructure as Code Terraform
System programming skills in Go Ruby etc
Diagnose and troubleshooting Java applications
Familiar with CICD practices and tools Git Jenkins
Strong understanding of nix system and networking concepts
Understanding of distributed eventbased messaging architectures Kafka etc
Strong interpersonal and teaming skills ability to implement process and influence engineers who are not direct reports
Ability to operate in an agile entrepreneurial startup environment
Education
Bachelors degree in Computer Science or other technical discipline or equivalent experience
All qualified applicants will receive consideration for employment without regard to race color religion sex sexual orientation gender identity national origin disability or veteran status"
Database Administrator,job description part implant team responsible developing tool team use creation preoperative planning software need create database capture organizes specific information implant compatible system ideal candidate would someone ha come structured environment understands need documentation need able create python c know create implement testing validate design expertise database schema design focus designing frontend core component work crossfunctionally different development team ensure user need implemented write documentation comply process fda
Backend Developer,"Basic Info
Location
Bangalore Karnataka India
Job type
FullTime
Contract
RegularPermanent
Take the next step in your career at ABB working in a team that is dedicated to creating a future where innovative digital technologies allow greater access to cleaner energy
ABB Global Industries and Services Private Limited GISPL is a company which has 4 business areas to support ABB projects globally We have 2000 employees as a part of this company serving in the areas of Research Development Engineering center and Regional ERP support center which contributes to ABBs 4 business areas globally In 2015 the company name was registered as ABB Global Industries and Services Private Limited GISPL
ABB Motion is a pioneering technology leader driving innovation in motion industries We keep the world turning while saving energy every day Our motors and drives are an integral part of everyones lives writing the future of smart motion
This is a Backend Web Developer role reporting Division RD Manager in Business Area Motion located in Bangalore You will involve in contributing to your ideas to identifying proposing and implementing innovative technology development and solutions
Your responsibilities
Architecting designing coding and unit testing of software modules based on the requirements
Developing existing systems by analyzing and identifying areas for improvements
Maintaining systems by identifying and correcting software defects
Creating designarchitecture documents technical specifications and test cases in line with quality systems
Providing estimates for work on the effort scheduling to project manager and actively participating in preparing detailed project documentation
Reviewing and coaching team members by investigating new technologies
Consulting internal external stakeholders concerning the maintenance and performance of software systems implementing software solutions
Living ABBs core values of safety and integrity which means taking responsibility for your own actions while caring for your colleagues and the business
Your background
Bachelors or masters degree in computer science electronics electrical instrumentation engineering or equivalent
68 years of experience on advanced C NET NET Core WebAPI Unit Testing NunitXunit XML LINQ design patterns with minimum 1 year of experience in Azure and cloud development
Strong concepts of Objectoriented Programming System OOPS TypeScript HTMLCSS and Bootstrap
Experience in Azure DevOps continuous integration configuration management
Good knowledge on using entity framework entity framework core
Good knowledge of SQL server and database scripting
Good understanding of Azure DevOps
Good to have experience in Azure pipelines and deployments
More about us
Bring your very own sense of pride and purpose as you help us drive forward the Fourth Industrial Revolution creating a sustainable future for our planet and your career Join ABB and harness the power of our diverse global network as you collaborate with and learn from our worldclass teams Above all challenge yourself every day Lets write the future together
Important please include in your CV the following passage
I hereby agree for my personal data included in my job application to be processed in line with the needs of recruitment in accordance with the Law on Personal Data Protection of 29th August 1997 Law Gazette from 2002 No101 heading 926 as amended
Reference Number
IN76077323E2
Publication date
20201105"
JavaScript Developer,"Requisition ID 270442
Work Area SoftwareDesign and Development
Expected Travel 0 10
Career Status Professional
Employment Type Regular Full Time
COMPANY DESCRIPTION
SAP started in 1972 as a team of five colleagues with a desire to do something new Together they changed enterprise software and reinvented how business was done Today as a market leader in enterprise application software we remain true to our roots Thats why we engineer solutions to fuel innovation foster equality and spread opportunity for our employees and customers across borders and cultures
SAP values the entrepreneurial spirit fostering creativity and building lasting relationships with our employees We know that a diverse and inclusive workforce keeps us competitive and provides opportunities for all We believe that together we can transform industries grow economics lift up societies and sustain our environment Because its the bestrun businesses that make the world run better and improve peoples lives
JOB TITLE
Developer JavaJavaScriptSpring BootNodeJS CX Retail
ROLE
Responsible for development focusing on design coding testing quality assurance of complex product features in a development team
Resolves complex issues within own area of expertise and supports others in resolving issues
Shows initiative and drives topics to resolution in a high level of quality speed reliability and efficiency
Constantly improves own work methods to gain stateoftheart agile software engineering skills and enhances skills beyond own core functional focus and works on other tasks for the benefit of the team
Has advanced overall product and technical knowledge and shares expertise within and across organization
You will have an opportunity to understand the complete CRM Sales Cycle by collaborating within and outside the team and will need to directly interact with internal and external customers
Perform product design modeling implementation and testing
Work in accordance with agile development models Scrum Agile
Collaboarate with Product Management and UX Designers to translate customer requests into useful product functionality
EXPERIENCE
37 years of total experience
BEBTechMCAMTech degree in Computer Science or equivalent
Excellent software development skills in one or more of the following languages JavaJavaScript
Experience in Spring Boot NodeJS frameworks would be preferred
Has experience designing building and delivering Services in a Continuous Delivery environment
Has experience in building scalable UIs using AngularUI5
Has strong experience in agile methodologies SCRUM Kanban
Understands REST APIgRPC with strong working knowledge on REST API
Working knowledge of Kafka Elasticsearch AWS Kubernetes Mongo would be an added advantage
ABOUT THE TEAM
We in CX Retail Execution provide appealing products combining software configuration and customizing tools with a rich user experience integrating emerging trends such as the use of Social Media and mobile devices for interaction with consumers
SOF2020
WHAT YOU GET FROM US
Success is what you make it At SAP we help you make it your own A career at SAP can open many doors for you If youre searching for a company thats dedicated to your ideas and individual growth recognizes you for your unique contributions fills you with a strong sense of purpose and provides a fun flexible and inclusive work environment apply now
SAPS DIVERSITY COMMITMENT
To harness the power of innovation SAP invests in the development of its diverse employees We aspire to leverage the qualities and appreciate the unique competencies that each person brings to the company
SAP is committed to the principles of Equal Employment Opportunity and to providing reasonable accommodations to applicants with physical andor mental disabilities If you are in need of accommodation or special assistance to navigate our website or to complete your application please send an email with your request to Recruiting Operations Team Americas CareersNorthAmericasapcom or CareersLatinAmericasapcom APJ CareersAPJsapcom EMEA Careerssapcom
Successful candidates might be required to undergo a background verification with an external vendor
Additional Locations"
iOS Developer,"We are urgently looking for an iOS Developer who possesses a passion for pushing mobile technologies to the limits We need an iOS Developer with 35 years of experience in iOS Mobile application development The detail Job Description and desired profile for the proposed position are as under
Eligibility
Experience 35 years 
Education BE BTech CS MCA Degree
Job Location Delhi NCR
Job Ref code 1907iOS01
Industry ITComputers Software
Desired Profile
Must 34 years of experience as iOS Developer
Having knowledge of Configuration Management tools TFS SVN etc
Experience with iOS frameworks such as Core Data Core Animation etc
Expertise with iOS SDK UIKit Cocoa Touch WebKit etc
Design and build applications for the iOS platform
Proficient with ObjectiveC or Swift or React Native
Familiarity with RESTful APIs to connect iOS applications to backend services
Knowledge of other web technologies and UIUX standard
Should have developed 45 applications at least as per Apple standards minimum 23 currently on the App Store
Desirable Skills
Knowledge of PhoneGap
Job Type Contractual Initially for 1 year
Job Location Delhi IT Park Shastri Park
Joining Time Immediate or 15 to 20 days"
JavaScript Developer,"At Sincro we build local marketing technology for automotive dealers manufacturers and marketing associations We have 25 years of experience and more than 7000 customers in North America and internationally In April 2020 Sincro was acquired by Ansira an independent global marketing services and solutions company Together Ansira and Sincro are the leading providers of hyperlocal marketing services and technologies among automotive clients to build and maintain brand loyalty
Headquartered in Seattle WA with offices in Detroit Chicago and India our team is passionate about our products and the success of our customers
Knowledge Areas Essential skills
Strong knowledge of native JavaScript including ES5 ES6 and a strong understanding of browser compatibility implications
Good HTMLCSSAJAXJavaScript client side coding experience
Proficiency in one or more advanced JavaScript frameworks such as React Angular or Vue and open to learn and move other framework
Proficiency using GIT for source code management
Proficiency at using browser development tools within each major browser
Good understanding of asynchronous request handling and AJAX
Understanding of W3C WCAG web accessibility requirements is a plus
Understanding of SEO principals as it applies to frontend development is a plus
Understanding of page rendering concepts within a browser is a plus
Key Job Responsibilities
Responsible for endend feature development develop test release and monitor
Optimize applications for maximum speed and scalability
Build sustainable reusable code and libraries for future use
Ensure feasibility of UIUX designs
Analyse code requirements and risks
Collaborate with members of your own team and other teams to make sure endtoend requirements are met
Debugtroubleshoot issues with existing code
Work Experience
2 to 4 years in web technologies HTML CSS JavaScript
Full stack web development experience
Hands on experience in server side JavaScripting NodeJS
Experience with responsive design for desktopmobile
Experience working in a teamoriented collaborative environment
Educational Qualifications
BE BTech MTech MCA
Local Marketing Synchronized"
